[I 2024-05-02 18:03:31,948] A new study created in memory with name: no-name-2751dc0b-f214-497e-8de5-62a47eebc863
GPU available: True (cuda), used: True
TPU available: False, using: 0 TPU cores
IPU available: False, using: 0 IPUs
HPU available: False, using: 0 HPUs
Missing logger folder: tb_logs/hyperopt/data
LOCAL_RANK: 0 - CUDA_VISIBLE_DEVICES: [0]
SLURM auto-requeueing enabled. Setting signal handlers.
cuda True
NVIDIA GeForce RTX 3090
Results will be saved in: hyperopt_2
[I 2024-05-02 18:19:24,734] Trial 0 finished with value: 0.026762595400214195 and parameters: {'model_file': 'mp_2020_10_09.dim30.keras.model'}. Best is trial 0 with value: 0.026762595400214195.
GPU available: True (cuda), used: True
TPU available: False, using: 0 TPU cores
IPU available: False, using: 0 IPUs
HPU available: False, using: 0 HPUs
LOCAL_RANK: 0 - CUDA_VISIBLE_DEVICES: [0]
SLURM auto-requeueing enabled. Setting signal handlers.
[I 2024-05-02 18:36:48,816] Trial 1 finished with value: 0.02931348979473114 and parameters: {'model_file': 'mp_2020_10_09.dim200.keras.model'}. Best is trial 0 with value: 0.026762595400214195.
GPU available: True (cuda), used: True
TPU available: False, using: 0 TPU cores
IPU available: False, using: 0 IPUs
HPU available: False, using: 0 HPUs
LOCAL_RANK: 0 - CUDA_VISIBLE_DEVICES: [0]
SLURM auto-requeueing enabled. Setting signal handlers.
[I 2024-05-02 18:51:07,313] Trial 2 finished with value: 0.030674075707793236 and parameters: {'model_file': 'mp_2020_10_09.dim200.keras.model'}. Best is trial 0 with value: 0.026762595400214195.
GPU available: True (cuda), used: True
TPU available: False, using: 0 TPU cores
IPU available: False, using: 0 IPUs
HPU available: False, using: 0 HPUs
LOCAL_RANK: 0 - CUDA_VISIBLE_DEVICES: [0]
SLURM auto-requeueing enabled. Setting signal handlers.
[I 2024-05-02 19:05:05,954] Trial 3 finished with value: 0.030064163729548454 and parameters: {'model_file': 'mp_2020_10_09.dim30.keras.model'}. Best is trial 0 with value: 0.026762595400214195.
GPU available: True (cuda), used: True
TPU available: False, using: 0 TPU cores
IPU available: False, using: 0 IPUs
HPU available: False, using: 0 HPUs
LOCAL_RANK: 0 - CUDA_VISIBLE_DEVICES: [0]
SLURM auto-requeueing enabled. Setting signal handlers.
[I 2024-05-02 19:17:51,683] Trial 4 finished with value: 0.03085288032889366 and parameters: {'model_file': 'mp_2020_10_09.dim30.keras.model'}. Best is trial 0 with value: 0.026762595400214195.
GPU available: True (cuda), used: True
TPU available: False, using: 0 TPU cores
IPU available: False, using: 0 IPUs
HPU available: False, using: 0 HPUs
LOCAL_RANK: 0 - CUDA_VISIBLE_DEVICES: [0]
SLURM auto-requeueing enabled. Setting signal handlers.
[I 2024-05-02 19:30:50,142] Trial 5 finished with value: 0.028482189401984215 and parameters: {'model_file': 'mp_2020_10_09.dim250.keras.model'}. Best is trial 0 with value: 0.026762595400214195.
GPU available: True (cuda), used: True
TPU available: False, using: 0 TPU cores
IPU available: False, using: 0 IPUs
HPU available: False, using: 0 HPUs
LOCAL_RANK: 0 - CUDA_VISIBLE_DEVICES: [0]
SLURM auto-requeueing enabled. Setting signal handlers.
[I 2024-05-02 19:43:37,776] Trial 6 finished with value: 0.029697014018893242 and parameters: {'model_file': 'mp_2020_10_09.dim250.keras.model'}. Best is trial 0 with value: 0.026762595400214195.
GPU available: True (cuda), used: True
TPU available: False, using: 0 TPU cores
IPU available: False, using: 0 IPUs
HPU available: False, using: 0 HPUs
LOCAL_RANK: 0 - CUDA_VISIBLE_DEVICES: [0]
SLURM auto-requeueing enabled. Setting signal handlers.
[I 2024-05-02 20:03:49,061] Trial 7 finished with value: 0.028561430051922798 and parameters: {'model_file': 'mp_2020_10_09.dim200.model'}. Best is trial 0 with value: 0.026762595400214195.
GPU available: True (cuda), used: True
TPU available: False, using: 0 TPU cores
IPU available: False, using: 0 IPUs
HPU available: False, using: 0 HPUs
LOCAL_RANK: 0 - CUDA_VISIBLE_DEVICES: [0]
SLURM auto-requeueing enabled. Setting signal handlers.
[I 2024-05-02 20:21:43,150] Trial 8 finished with value: 0.02892894297838211 and parameters: {'model_file': 'mp_2020_10_09.dim200.model'}. Best is trial 0 with value: 0.026762595400214195.
Best trial: 0
Best value (RMSE): 0.026762595400214195
model_file: mp_2020_10_09.dim30.keras.model
